{
  "$schema": "../../schema/project.schema.json",
  "client": "Opitz Consulting Deutschland GmbH",
  "role": {
    "de": "Frontend-Entwickler",
    "en": "Frontend Developer"
  },
  "location": "Essen",
  "workload": {
    "de": "Werkstudent bis 09/2019, danach Festanstellung",
    "en": "working student until Sep 2019, then permanent position"
  },
  "startDate": "2018-04",
  "endDate": "2021-08",
  "responsibilities": [
    {
      "de": "Entwicklung in Kundenprojekten der Industrie- und Mobilitätsbranche in Scrum-Teams — u. a. erfolgreicher Relaunch einer Webanwendung mit über 100.000 monatlichen Besuchern",
      "en": "Development in client projects across the industrial and mobility sectors in Scrum teams — including a successful relaunch of a web application with over 100,000 monthly visitors"
    },
    {
      "de": "Leitung einer internen Schulungsreihe zu Angular & TypeScript mit über 20 Teilnehmenden",
      "en": "Led an internal training series on Angular & TypeScript with over 20 participants"
    }
  ],
  "achievements": [],
  "stack": ["Angular", "TypeScript", "NgRx", "RxJS", "Angular Material", "Java", "Spring Boot", "Microservices", "Docker", "Kubernetes", "Jenkins", "Azure", "AWS", "Keycloak"]
}
