{
  "$schema": "../../schema/project.schema.json",
  "client": "eco.income engineering GmbH",
  "role": {
    "de": "Fullstack-Entwickler — CO₂-Bilanzierungs-Software (Next.js)",
    "en": "Fullstack Developer — Carbon Accounting Software (Next.js)"
  },
  "location": "Hamburg",
  "workload": { "de": "Teilzeit", "en": "part-time" },
  "startDate": "2022-10",
  "endDate": "2023-03",
  "responsibilities": [
    {
      "de": "Entwicklung einer SaaS-Lösung zur CO₂-Bilanzierung als einziger Entwickler: Unternehmen laden Bank-Transaktionsdaten hoch und erhalten daraus berechnete Scope-1-, Scope-2- und Scope-3-Emissionen",
      "en": "Sole developer of a SaaS solution for corporate carbon accounting: companies upload bank transaction data and receive calculated Scope 1, Scope 2 and Scope 3 emissions"
    },
    {
      "de": "Aufbau von Grund auf in direkter Zusammenarbeit mit dem Gründer (Early-Stage-Startup) — Softwarearchitektur, Datenmodell, eigenes Node.js-Backend (Express, TypeORM) und Frontend bis zum Launch und Onboarding der ersten zahlenden B2B-Kunden",
      "en": "Built from the ground up in direct collaboration with the founder (early-stage startup) — software architecture, data model, custom Node.js backend (Express, TypeORM) and frontend through launch and onboarding of the first paying B2B customers"
    }
  ],
  "achievements": [],
  "stack": ["Next.js", "React", "TypeScript", "Node.js", "PostgreSQL", "AG Grid", "Docker", "Google Cloud", "Terraform", "GitLab"]
}
