{
  "$schema": "../../schema/project.schema.json",
  "client": "pub.tech (ARD)",
  "role": {
    "de": "Frontend-Entwickler — tagesschau.de, sportschau.de & ard.de (Next.js)",
    "en": "Frontend Developer — tagesschau.de, sportschau.de & ard.de (Next.js)"
  },
  "location": { "de": "München", "en": "Munich" },
  "startDate": "2025-09",
  "endDate": "2026-09",
  "responsibilities": [
    {
      "de": "Entwicklung wiederverwendbarer Frontend-Komponenten für die reichweitenstärksten Nachrichtenangebote Deutschlands (tagesschau.de, sportschau.de, brisant.de, ard.de) im mehrköpfigen Frontend-Team",
      "en": "Developed reusable frontend components for Germany's highest-reach news platforms (tagesschau.de, sportschau.de, brisant.de, ard.de) in a multi-developer frontend team"
    }
  ],
  "achievements": [
    {
      "de": "Migration von ard.de und brisant.de auf ein neues CMS — ohne Beeinträchtigung des Live-Betriebs",
      "en": "Migrated ard.de and brisant.de to a new CMS — with zero disruption to live operation"
    }
  ],
  "stack": ["JavaScript", "TypeScript", "Next.js", "React", "TailwindCSS", "Node.js", "Docker"]
}
