{
  "$schema": "../../schema/project.schema.json",
  "client": { "de": "Objego GmbH (ista-Ausgründung)", "en": "Objego GmbH (ista spin-off)" },
  "role": {
    "de": "Frontend-Entwickler – Vermieter-Software Objego (Angular)",
    "en": "Frontend Developer — Objego Landlord Software (Angular)"
  },
  "location": "Essen",
  "startDate": "2021-08",
  "endDate": "2022-02",
  "responsibilities": [
    {
      "de": "Weiterentwicklung des Vermieter-Webportals (Fokus Performance) inkl. Konzeption und Umsetzung des Nutzer-Trackings",
      "en": "Extended the landlord web portal (performance focus); designed and built user tracking"
    }
  ],
  "achievements": [],
  "stack": ["Angular", "TypeScript", "NgRx", "RxJS", "Tailwind CSS", "Jest", "Cypress", "Azure", "Sentry"]
}
