{
  "$schema": "../../schema/project.schema.json",
  "client": "pub.tech (ARD)",
  "role": {
    "de": "Fullstack-Entwickler — hilfe.ard.de & games.ard.de (Next.js/Strapi)",
    "en": "Fullstack Developer — hilfe.ard.de & games.ard.de (Next.js/Strapi)"
  },
  "location": { "de": "München", "en": "Munich" },
  "startDate": "2025-09",
  "endDate": "2026-09",
  "responsibilities": [
    {
      "de": "Alleinverantwortliche Entwicklung von hilfe.ard.de — Aufbau des CMS (Strapi) und kontinuierliche Weiterentwicklung des Next.js-Frontends",
      "en": "Sole developer for hilfe.ard.de with full ownership — built the CMS (Strapi) and continuously developed the Next.js frontend"
    },
    {
      "de": "Weiterentwicklung des Frontends von games.ard.de sowie enge Zusammenarbeit mit den Redaktionsteams bei neuen CMS-Features",
      "en": "Frontend development for games.ard.de and close collaboration with the editorial teams on new CMS features"
    }
  ],
  "achievements": [],
  "stack": ["JavaScript", "TypeScript", "Next.js", "React", "Strapi", "Headless CMS", "TailwindCSS", "Node.js", "PostgreSQL", "Docker"]
}
