{
  "$schema": "../../schema/project.schema.json",
  "client": "Ista SE",
  "role": {
    "de": "Lead Frontend-Entwickler — Vermieter-Software Objego (Angular)",
    "en": "Lead Frontend Developer — Objego Landlord Software (Angular)"
  },
  "location": "Essen",
  "startDate": "2023-03",
  "endDate": "2024-12",
  "responsibilities": [
    {
      "de": "Weiterentwicklung der Web-Anwendung, mit der private Vermieter ihren Immobilienbestand verwalten und Daten für die Steuererklärung generieren — als Lead eines der beiden Entwicklungsteams mit fachlicher Führung von zwei Frontend-Entwicklern",
      "en": "Advanced the web application private landlords use to manage their property portfolio and generate tax return data — as lead of one of the two development teams, technically leading two frontend developers"
    },
    {
      "de": "Weiterentwicklung der Anwendungsarchitektur gemeinsam mit den anderen Lead-Entwicklern — Mitumsetzung der Migration von der monolithischen Angular-Anwendung zu NX-Monorepo und Micro Frontends",
      "en": "Evolved the application architecture together with the other lead developers — co-implemented the migration from a monolithic Angular application to an NX monorepo with micro frontends"
    }
  ],
  "achievements": [
    {
      "de": "Build- und Testzeiten um bis zu 80 % reduziert durch die Migration zu Monorepo und Micro Frontends",
      "en": "Reduced build and test times by up to 80% through the monorepo and micro frontend migration"
    },
    {
      "de": "Erneute Beauftragung nach früherem Engagement am selben Produkt (Objego, 2021/22)",
      "en": "Re-engaged after a previous assignment on the same product (Objego, 2021/22)"
    }
  ],
  "stack": [
    "JavaScript",
    "TypeScript",
    "Angular",
    "NX Monorepo",
    "NgRX",
    "RxJS",
    "Angular Material",
    "Micro Frontends",
    "TailwindCSS",
    "Storybook",
    "Jest",
    "Cypress",
    "Playwright",
    "Docker",
    "Kubernetes",
    "Azure",
    "GitHub Actions",
    "CI/CD",
    "Keycloak",
    "Sentry"
  ]
}
