{
  "$schema": "../../schema/project.schema.json",
  "client": "pub.tech (ARD)",
  "role": {
    "de": "Fullstack-Entwickler — ARD Sounds „Regional Update“: AI-Produkt & Multi-Sender-Rollout (Next.js)",
    "en": "Fullstack Developer — ARD Sounds \"Regional Update\": AI Product & Multi-Station Rollout (Next.js)"
  },
  "location": {
    "de": "München",
    "en": "Munich"
  },
  "startDate": "2025-09",
  "endDate": "2026-08",
  "responsibilities": [
    {
      "de": "Entwicklung des Frontends für das AI-personalisierte „Regional Update“ als einziger Softwareentwickler — das Feature spielt Nutzer:innen per KI ausgewählte Radiobeiträge mit Bezug zu ihrem Wunschort aus",
      "en": "Developed the frontend for the AI-personalized \"Regional Update\" as the sole software developer — the feature plays users AI-selected radio segments related to their chosen location"
    },
    {
      "de": "Umsetzung neuer Produkt-Features: Optimierung für mobile Endgeräte, Ausbau der Playlist-Funktionalität, Sharing-Funktion",
      "en": "Delivered new product features: mobile optimization, expanded playlist functionality, sharing feature"
    }
  ],
  "achievements": [
    {
      "de": "Ausweitung des zunächst auf den Bayerischen Rundfunk beschränkten Angebots auf weitere Landesrundfunkanstalten — heute live und über eine eigene ARD-Sounds-Subdomain erreichbar",
      "en": "Expanded the offering from initially Bayerischer Rundfunk only to additional regional broadcasters — now live and reachable under its own ARD Sounds subdomain"
    }
  ],
  "stack": [
    "JavaScript",
    "TypeScript",
    "Next.js",
    "React",
    "TailwindCSS"
  ]
}
