{
  "$schema": "../../schema/project.schema.json",
  "client": "Schaeffler AG",
  "role": {
    "de": "Frontend-Entwickler – Interne Beschaffungsplattform (Angular)",
    "en": "Frontend Developer — Internal Procurement Platform (Angular)"
  },
  "location": { "de": "Nürnberg (remote)", "en": "Nuremberg (remote)" },
  "startDate": "2022-03",
  "endDate": "2023-03",
  "responsibilities": [
    {
      "de": "Entwicklung neuer Features für eine global eingesetzte interne Plattform, über die Einkäufer Bestell- und Angebotsprozesse abwickeln – im großen, verteilten Entwicklungsteam",
      "en": "Developed new features for a globally used internal platform through which purchasers handle ordering and quotation processes — in a large, distributed development team"
    },
    {
      "de": "Eigenständige Konzeption und Umsetzung des Nutzer-Trackings (Azure Application Insights) als Grundlage für Produktentscheidungen – Absprungstellen, Feature-Nutzung, UX-Priorisierung",
      "en": "Independently designed and implemented user tracking (Azure Application Insights) as the data basis for product decisions — drop-off points, feature usage, UX prioritization"
    },
    {
      "de": "Mitarbeit an der Definition konzernweiter Code-Standards und Best Practices für Webanwendungen",
      "en": "Contributed to defining group-wide code standards and best practices for web applications"
    }
  ],
  "achievements": [],
  "stack": ["Angular", "TypeScript", "NgRx", "RxJS", "Nx (Monorepo)", "Angular Material", "AG Grid", "Jest", "Docker", "Kubernetes", "Jenkins", "CI/CD", "Azure Application Insights", "Keycloak"]
}
